title,url,thumbnail_url,channel,views,uploaded,description
Same vibe,https://www.youtube.com/watch?v=86bptfbUkc0,https://i.ytimg.com/vi/86bptfbUkc0/hqdefault.jpg?sqp=-oaymwFBCNACELwBSFryq4qpAzMIARUAAIhCGAHYAQHiAQoIGBACGAY4AUAB8AEB-AG2CIACgA-KAgwIABABGDkgZChyMA8=&rs=AOn4CLB8pjwwEMHH8JtZ0w0D5piSdumqAg,Tripplegreen,488K views,1 day ago,
PEELINGS (Malayalam Lyrical Video) | Pushpa 2 The Rule | Allu Arjun | Rashmika | Sukumar | DSP,https://www.youtube.com/watch?v=_VaOX6jRD3Y,https://i.ytimg.com/vi/_VaOX6jRD3Y/hqdefault.jpg?sqp=-oaymwEnCNACELwBSFryq4qpAxkIARUAAIhCGAHYAQHiAQoIGBACGAY4AUAB&rs=AOn4CLAKGFnXofX-wNm3ssZTYvChkF5wng,T-Series Malayalam,2.9M views,3 days ago,The Most Loved Jodi is Coming🔥! The Icon Star 'Allu Arjun' & the Amazing 'Rashmika Mandanna' is Ready to Set the Stage on fire with this New Banger! Pushpa 2 - The Rule - Written and Directed...
ആനിയോടുള്ള ദേഷ്യത്തെക്കുറിച്ച് തുറന്ന് പറഞ്ഞ് നജീം അർഷാദ് #najimarshad #singer #annie,https://www.youtube.com/watch?v=8f553mngccc,,Amrita TV Cookery Show,76K views,1 day ago,ആനിയോടുള്ള ദേഷ്യത്തെക്കുറിച്ച് തുറന്ന് പറഞ്ഞ് നജീം അർഷാദ് #AmritaTVCookeryShow #archives...
Extra Decent Official Trailer | Listin Stephen | Suraj Venjaramoodu | Aamir Pallikkal,https://www.youtube.com/watch?v=z_Mo697_bdI,,Magic Frames Music,783K views,2 days ago,"#listinstephen #surajvenjaramoodu #extradecent #malayalammove #officialtrailer #magicframes Presenting the official trailer of Extra Decent Movie, starring Suraj Venjaramoodu, directed..."
MALLORCA 1 vs 5 FC BARCELONA | LALIGA 2024/25 MD19,https://www.youtube.com/watch?v=iNpTB8MQNK4,,FC Barcelona,1.4M views,22 hours ago,"Hansi Flick's side win for the first time in four LaLiga matches, with goals by Raphinha (2), Ferran, Frenkie and Pau Víctor. SUBSCRIBE NOW: ▶ www.youtube.com/user/fcbarcelona 📱 App:..."
"SUHANAKKU ANNIVERSARY SHOPPING SURAT, GUJARAT IL NINNU 🤩🛍️ | SAI DRESSES | Mashura | Basheer Bashi",https://www.youtube.com/watch?v=JsDNf9clljU,,Basheer Bashi,176K views,1 day ago,➡️ Call / WhatsApp us : +91 9898971089 / +91 9687561855 ➡️ Direct on WhatsApp : https://wa.link/eisj96 / https://wa.link/rxjo5g ⏭️ Sai Dresses YouTube Channel Link : https://www.youtub...
Pirisha Kadalin Peran | New Music Video | Sajeer Koppam | Shabnam Rafeeque | Sibu Sukumaran,https://www.youtube.com/watch?v=WlkWD0fawXc,,Sajeer Koppam Official,130K views,1 day ago,Lyrics : Faisal Ponnani Music : Sajeer Koppam Singers : Sajeer Koppam & Shabnam Rafeeque Programming Mix : Sibu Sukumaran Flute : Abhijith S Naranayanan Guitar : Athul T Piano : Siju k Puram...
ഞങ്ങളെ എല്ലാവരും അനുഗ്രഹിക്കണം🙏🙏,https://www.youtube.com/watch?v=laLycPdjxlI,,Njangal Inganokkeya,852K views,3 days ago,#deepthiseethathode#njangalinganokkeya#villagelife#kerala#reallifevlog#love#dayinmylife#
Sundari - Best Scenes | Part - 2 | 01 Dec 2024 | Tamil Serial | Sun TV,https://www.youtube.com/watch?v=_m1mV_TADWU,,Sun TV,2.9M views,2 days ago,Watch the Best Scenes of popular Tamil Serial #Sundari that airs on Sun TV. Watch all Sun TV serials immediately after the TV telecast on Sun NXT app. *Free for Indian Users only Download...
ജിമിക്കി എനിക്ക് വീക്നെസ്സ് | Super Star|Amrita TV,https://www.youtube.com/watch?v=xtXrcMHorh0,,Amrita TV Shows,280K views,1 day ago,#superstar #amritatv #Musicrealityshow #newrealityshow2024 ജിമിക്കി എനിക്ക് വീക്നെസ്സ് Super Star | Monday to Thursday @ 8pm | Amrita...
