title,url,thumbnail_url,channel,views,uploaded,description
Vidaamuyarchi Teaser | Ajith Kumar | Trisha | Arjun | Magizh Thirumeni | Anirudh | Subaskaran | Lyca,https://www.youtube.com/watch?v=Wtq3RRORVx4,https://i.ytimg.com/vi/Wtq3RRORVx4/hqdefault.jpg?sqp=-oaymwEcCNACELwBSFXyq4qpAw4IARUAAIhCGAFwAcABBg==&rs=AOn4CLB8CYEwmHDQ3tpyNoHAQOH3ZNzL7w,Sun TV,9.8M views,2 days ago,"Presenting the Official Teaser of the the movie ""Vidaamuyarchi"", Starring Ajith Kumar, Trisha, Arjun & others. Directed by Magizh Thirumeni, Music by Anirudh, Produced by Subaskaran, Lyca Productio..."
Home tour of Kottayam Nazeer ikka🏡,https://www.youtube.com/watch?v=Mq8hPypJoqA,https://i.ytimg.com/vi/Mq8hPypJoqA/hqdefault.jpg?sqp=-oaymwEcCNACELwBSFXyq4qpAw4IARUAAIhCGAFwAcABBg==&rs=AOn4CLCDEhYm8RfUy_6qtTmHvZD4uanf_Q,Karthik Surya,186K views,18 hours ago,https://paintemic.com/ https://www.instagram.com/paintemicbykottayamnazeer @KottayamNazeerArtStudio whats app +91 8590196130 Want to send me some goodies? Here’s my address ;) ➤ Karthik...
Marco Promo Song-Marpapa | Baby Jean | Saeed Abbas | Unni Mukundan | Shareef Muhammed | Haneef Adeni,https://www.youtube.com/watch?v=9wKSeAq9Kp8,,Sony Music South,839K views,1 day ago,Movie - Marco Song - Marpapa Music composed- Saeed Abbas Singers - Baby Jean Lyrics - Vinayak Sasikumar Additional Music Production - Nivin Raphael Song Mixed - Abin Paul Song Mastered - Gethin...
ഡിസംബർ 01 | കൃപാസനം അനുദിന അനുഗ്രഹ പ്രാർത്ഥന | Our Daily Bread |പ്രത്യക്ഷീകരണത്തിന്റെ ഇരുപതാം വർഷം.,https://www.youtube.com/watch?v=12toOJpbdHY,,Fr V.P Joseph Kreupasanam Official,86K views,7 hours ago,Prayer Assurance!!!!! Join with us in Kreupasanam Whatsapp channel by following below link!! Follow the Society Of Kreupasanam channel on WhatsApp: https://whatsapp.com/channel/0029Vaecb8JHAdNWerb...
PEELINGS Song - Promo | Pushpa 2 The Rule | Allu Arjun | Rashmika Mandanna | Sukumar | DSP,https://www.youtube.com/watch?v=jRWJBuHoqJA,,T-Series Telugu,3.4M views,1 day ago,Get Ready For The Biggest Blockbuster Flashing Worldwide 🔥! The Icon Star 'Allu Arjun' & the Dancing Queen 'Rashmika Mandanna' Is Coming to Rock The Floor! Song Releasing on 1st Dec 2024....
Antarctica 🇦🇶 #3 - South Shetland Antarctic Islands | മഞ്ഞിന്റെ അത്ഭുത ലോകം അന്റാർട്ടിക്ക കാണാം,https://www.youtube.com/watch?v=pXg1XtutlWo,,sherinz Vlog,233K views,1 day ago,#sherinzvlog #antarctica #antarcticadventure അന്റാർട്ടിക്ക യാത്രയുടെ മുഴുവൻ എപ്പിസോഡുകൾ കാണാൻ Antarctica...
I face off with MrBeast,https://www.youtube.com/watch?v=_ZsZ4-HyjCg,,UR · Cristiano,11M views,14 hours ago,"Cristiano and Jimmy engage in a high-stakes challenge… and they put all their subscribers on the line. Check out MrBeast’s awesome collab https://youtu.be/0BjlBnfHcHM Available in English,..."
Episode 02 | 90's v/s 2K Dating | by Kaarthik Shankar #90svs2kdating,https://www.youtube.com/watch?v=dOm6HSF89nU,,Kaarthik Shankar,113K views,20 hours ago,90's v/s 2K Dating Episode 02 by Kaarthik Shankar #90svs2kdating #malayalam #comedy Directed By KAARTHIK SHANKAR Written By KAARTHIK SHANKAR BENZ BS cinematography APPU
FINALLY WE FOUND OUR HEAVEN 🥰,https://www.youtube.com/watch?v=p2JABC6gDhc,,Praveen Pranav,1.6M views,18 hours ago,#ourhome #family #praveen our second channel : https://youtube.com/@PraveenPranav2.0 . for business :praveenpb513@gmail.com 📩 . .Instagram follow . Praveen : https://www.instagram.com/prave...
അവൾക്ക് ഇങ്ങനെ ഒരു surprise ഗിഫ്റ്റ് ആദ്യമായിട്ടായിരിക്കും.അവസാനം ഉമ്മയുടെ മുന്നിൽ വെച് കരഞ്ഞു അവൾ 🥲,https://www.youtube.com/watch?v=59lG5qvazGs,,jilshad vallapuzha Official,122K views,1 day ago,#familyvlog #birthdayjinsi #jilshadjinsi
